"Key","Item Type","Publication Year","Author","Title","Publication Title","ISBN","ISSN","DOI","Url","Abstract Note","Date","Date Added","Date Modified","Access Date","Pages","Num Pages","Issue","Volume","Number Of Volumes","Journal Abbreviation","Short Title","Series","Series Number","Series Text","Series Title","Publisher","Place","Language","Rights","Type","Archive","Archive Location","Library Catalog","Call Number","Extra","Notes","File Attachments","Link Attachments","Manual Tags","Automatic Tags","Editor","Series Editor","Translator","Contributor","Attorney Agent","Book Author","Cast Member","Commenter","Composer","Cosponsor","Counsel","Interviewer","Producer","Recipient","Reviewed Author","Scriptwriter","Words By","Guest","Number","Edition","Running Time","Scale","Medium","Artwork Size","Filing Date","Application Number","Assignee","Issuing Authority","Country","Meeting Name","Conference Name","Court","References","Reporter","Legal Status","Priority Numbers","Programming Language","Version","System","Code","Code Number","Section","Session","Committee","History","Legislative Body"
"266H9M9V","book","2010","Regester, Charlene B","African American actresses the struggle for visibility, 1900-1960","","978-0-253-00431-4 978-1-282-66329-9","","","http://public.eblib.com/choice/publicfullrecord.aspx?p=547023","Nine actresses, from Madame Sul-Te-Wan in Birth of a Nation (1915) to Ethel Waters in Member of the Wedding (1952), are profiled in African American Actresses. Charlene Regester poses questions about prevailing racial politics, on-screen and off-screen identities, and black stardom and white stardom. She reveals how these women fought for their roles as well as what they compromised (or didn't compromise). Regester repositions these actresses to highlight their contributions to cinema in the first half of.","2010","2016-04-19 20:34:49","2016-04-19 20:34:49","2016-04-19 20:34:49","","","","","","","","","","","","Indiana University Press","Bloomington","English","","","","","Open WorldCat","","","","","","","","","","","","","","","","","","","","","","","","","","","","","","","","","","","","","","","","","","","","","","","","","","","","",""
"2AUM3IFZ","journalArticle","2000","Butters, Jr., Gerald R.","From Homestead to Lynch Mob: Portrayals of Black Masculinity in Oscar Micheaux’s Within Our Gates","Journal for MultiMedia History,","","","","","","2000","2016-04-14 21:43:23","2016-04-14 21:45:12","","","","","3","","","","","","","","","","","","","","","","","","","","","","","","","","","","","","","","","","","","","","","","","","","","","","","","","","","","","","","","","","","","","","","","","","","",""
"389MT2VT","webpage","","","The Black Film Center/Archive | Indiana University Bloomington","","","","","http://www.indiana.edu/~bfca/home/","","","2016-04-14 21:10:33","2016-04-14 21:10:33","2016-04-14 21:10:33","","","","","","","","","","","","","","","","","","","","","","","/Users/karlacontreras/Library/Application Support/Zotero/Profiles/v1v2wix2.default/zotero/storage/PBQPJNJF/home.html","","","","","","","","","","","","","","","","","","","","","","","","","","","","","","","","","","","","","","","","","","","","","","","","",""
"3H2HCKMB","book","2003","Massood, Paula J","Black city cinema: African American urban experiences in film","","978-1-59213-002-3 978-1-59213-003-0","","","","This work shows how popular films reflected the massive social changes that resulted from the Great Migration of African Americans from the rural south to cities in the North, West, and Mid-West during the first three decades of the 20th century. By the onset of the Depression, the Black population had become primarily urban, transforming individual lives as well as urban experience and culture. The text probes into the relationship of place and time, showing how urban settings became an intrinsic element of African American film as Black people became more firmly rooted in urban spaces and more visible as historical and political subjects. Illuminating the intersections of film, history, politics, and urban discourse, it considers the chief genres of African American and Hollywood narrative film: the black cast musicals of the 1920s and the ""race"" films of the early sound era to blaxploitation and the hood films as well as the work of Spike Lee toward the end of the 20th century.","2003","2016-04-14 21:31:04","2016-04-14 21:31:04","","","","","","","","Black city cinema","","","","","Temple University Press","Philadelphia","English","","","","","Open WorldCat","","","","","","","","","","","","","","","","","","","","","","","","","","","","","","","","","","","","","","","","","","","","","","","","","","","","",""
"3SMFQSFD","webpage","","","A rarity, resurrected: an all-black film from the silent era - Chicago Tribune","","","","","http://www.chicagotribune.com/entertainment/movies/ct-bert-williams-lime-kiln-club-blackface-20150507-column.html","","","2016-04-14 21:47:53","2016-04-14 21:47:53","2016-04-14 21:47:53","","","","","","","","","","","","","","","","","","","","","","","/Users/karlacontreras/Library/Application Support/Zotero/Profiles/v1v2wix2.default/zotero/storage/W3HMZ4R2/ct-bert-williams-lime-kiln-club-blackface-20150507-column.html","","","","","","","","","","","","","","","","","","","","","","","","","","","","","","","","","","","","","","","","","","","","","","","","",""
"48VXJVK6","book","2001","Bowser, Pearl; Gaines, Jane; Musser, Charles","Oscar Micheaux and His Circle: African-American Filmmaking and Race Cinema of the Silent Era","","978-0-253-33994-2","","","","","2001","2016-06-06 20:51:46","2016-06-06 20:51:46","","","","","","","","Oscar Micheaux and his circle","","","","","Indiana University Press","Bloomington","","","","","","","","","","","","","","","","","","","","","","","","","","","","","","","","","","","","","","","","","","","","","","","","","","","","","","","","","","",""
"4VZ8ND4A","webpage","","","From Blackface to Blaxploitation: Representations of African Americans in Film - Duke Library Exhibits","","","","","http://exhibits.library.duke.edu/exhibits/show/africanamericansinfilm/racefilms","","","2016-04-14 21:10:49","2016-04-14 21:10:49","2016-04-14 21:10:49","","","","","","","","","","","","","","","","","","","","","","","/Users/karlacontreras/Library/Application Support/Zotero/Profiles/v1v2wix2.default/zotero/storage/CTCQV7RR/racefilms.html","","","","","","","","","","","","","","","","","","","","","","","","","","","","","","","","","","","","","","","","","","","","","","","","",""
"4XNQ9ECB","book","2014","Lupack, Barbara","Richard E. Norman and race filmmaking","","978-0-253-01072-8","","","","","2014","2016-04-14 21:18:46","2016-04-14 21:18:46","","","","","","","","","","","","","","","","","","","","","","","","/Users/karlacontreras/Library/Application Support/Zotero/Profiles/v1v2wix2.default/zotero/storage/CCXEQ68W/868971231&referer=brief_results.html","","added","","","","","","","","","","","","","","","","","","","","","","","","","","","","","","","","","","","","","","","","","","","","","","",""
"54NVQK27","webpage","","","Black Film Research Online","","","","","http://bfro.uchicago.edu/","","","2016-04-14 21:07:36","2016-04-14 21:07:36","2016-04-14 21:07:36","","","","","","","","","","","","","","","","","","","","","","","/Users/karlacontreras/Library/Application Support/Zotero/Profiles/v1v2wix2.default/zotero/storage/8MKNVB3A/bfro.uchicago.edu.html","","","","","","","","","","","","","","","","","","","","","","","","","","","","","","","","","","","","","","","","","","","","","","","","",""
"598NRF3U","book","1993","Reid, Mark","Redefining Black film","","978-0-520-91284-7 978-0-585-27466-9 978-0-520-07901-4","","","http://hdl.handle.net/2027/heb.08138","This assessment of black film history distinguishes between American films that are controlled by Blacks and those which utilize black talent, but are controlled by Whites. The study ranges from the earliest black involvement in Hollywood to present feminist influences in black productions.","1993","2016-04-14 21:20:53","2016-04-14 21:20:53","2016-04-14 21:20:53","","","","","","","","","","","","University of California Press","Berkeley","English","","","","","Open WorldCat","","","","","","added","","","","","","","","","","","","","","","","","","","","","","","","","","","","","","","","","","","","","","","","","","","","","","",""
"5CQAVJTV","book","2014","Caddoo, Cara","Envisioning Freedom: Cinema and the Building of Modern Black Life","","","","","","","2014","2016-04-14 21:16:52","2016-06-06 20:40:16","","","","","","","","Envisioning freedom","","","","","Harvard University Press","Cambridge, Mass.","","","","","","","","","","/Users/karlacontreras/Library/Application Support/Zotero/Profiles/v1v2wix2.default/zotero/storage/55AXMX6K/875999879&referer=brief_results.html","","added","","","","","","","","","","","","","","","","","","","","","","","","","","","","","","","","","","","","","","","","","","","","","","",""
"5DXZ28BZ","book","2001","Williams, Linda","Playing the race card : melodramas of black and white from Uncle Tom to O.J. Simpson","","978-0-691-05800-9","","","","","2001","2016-04-14 21:21:28","2016-04-14 21:21:28","","","","","","","","Playing the race card","","","","","Princeton University Press","Princeton  N.J.","","","","","","","","","","/Users/karlacontreras/Library/Application Support/Zotero/Profiles/v1v2wix2.default/zotero/storage/W7AQKVM2/44586476&referer=brief_results.html","","","","","","","","","","","","","","","","","","","","","","","","","","","","","","","","","","","","","","","","","","","","","","","","",""
"5NSGDNXU","webpage","","","Integrating the Life of the Mind: African Americans at the University of Chicago, 1870 - 1940 >","","","","","http://www.lib.uchicago.edu/e/webexhibits/IntegratingTheLifeOfTheMind/CreditStudyingScience.html","","","2016-05-16 17:53:12","2016-05-16 17:53:12","2016-05-16 17:53:12","","","","","","","","","","","","","","","","","","","","","","","/Users/karlacontreras/Library/Application Support/Zotero/Profiles/v1v2wix2.default/zotero/storage/9FFF72PB/CreditStudyingScience.html","","","","","","","","","","","","","","","","","","","","","","","","","","","","","","","","","","","","","","","","","","","","","","","","",""
"77RQIEWR","webpage","","","MC Journal. African-American Video Resources: A Select Guide by Patricia McGee","","","","","http://wings.buffalo.edu/publications/mcjrnl/v7n2/mcgee.html","","","2016-04-14 21:10:14","2016-04-14 21:10:14","2016-04-14 21:10:14","","","","","","","","","","","","","","","","","","","","","","","/Users/karlacontreras/Library/Application Support/Zotero/Profiles/v1v2wix2.default/zotero/storage/MBXDFNEB/mcgee.html","","","","","","","","","","","","","","","","","","","","","","","","","","","","","","","","","","","","","","","","","","","","","","","","",""
"7VXZ5ES4","webpage","","","Guide to the African Americans in Film Collection of Press Books, Campaign Books, Advertising Manuals, and Ephemera, 1919-2000 | Collection Guides | Rubenstein Library","","","","","http://library.duke.edu/rubenstein/findingaids/africanamericansfilm/","","","2016-04-14 21:58:18","2016-04-14 21:58:18","2016-04-14 21:58:18","","","","","","","","","","","","","","","","","","","","","","","/Users/karlacontreras/Library/Application Support/Zotero/Profiles/v1v2wix2.default/zotero/storage/FDHFZREN/africanamericansfilm.html","","","","","","","","","","","","","","","","","","","","","","","","","","","","","","","","","","","","","","","","","","","","","","","","",""
"824WHRGI","webpage","","","North Star: Film Resources","","","","","https://www.princeton.edu/~jweisenf/northstar/volume2/v2n2doc.html","","","2016-04-14 21:15:01","2016-04-14 21:15:01","2016-04-14 21:15:01","","","","","","","","","","","","","","","","","","","","","","","/Users/karlacontreras/Library/Application Support/Zotero/Profiles/v1v2wix2.default/zotero/storage/XXX48HH8/v2n2doc.html","","added","","","","","","","","","","","","","","","","","","","","","","","","","","","","","","","","","","","","","","","","","","","","","","",""
"8W66VKBW","webpage","","","Solomon Sir Jones Films, 1924-1928 | Beinecke Rare Book & Manuscript Library","","","","","http://beinecke.library.yale.edu/collections/highlights/solomon-sir-jones-films-1924-1928","","","2016-04-14 21:05:33","2016-04-14 21:05:33","2016-04-14 21:05:33","","","","","","","","","","","","","","","","","","","","","","","/Users/karlacontreras/Library/Application Support/Zotero/Profiles/v1v2wix2.default/zotero/storage/T55QE75G/solomon-sir-jones-films-1924-1928.html","","","","","","","","","","","","","","","","","","","","","","","","","","","","","","","","","","","","","","","","","","","","","","","","",""
"9GP6PIM6","webpage","","","Booker T. Washington and W. E. B. Du Bois: The Origins of a Bitter Intellectual Battle (Article, 2004) [UCLA Library]","","","","","http://ucla.worldcat.org/oclc/15400362650552&referer=brief_results","","","2016-04-14 21:28:33","2016-04-14 21:28:33","2016-04-14 21:28:33","","","","","","","","","","","","","","","","","","","","","","","/Users/karlacontreras/Library/Application Support/Zotero/Profiles/v1v2wix2.default/zotero/storage/F5KFCHNV/15400362650552&referer=brief_results.html","","Intellectual Battle","","","","","","","","","","","","","","","","","","","","","","","","","","","","","","","","","","","","","","","","","","","","","","",""
"9VXVHXZQ","book","1996","Bernardi, Daniel, ed.","The Birth of Whiteness: Race and the Emergence of U.S. Cinema","","","","","","","1996","2016-04-14 21:46:23","2016-04-14 21:47:17","","","","","","","","","","","","","Rutgers University Press","New Brunswick  N.J.","","","","","","","","","","","","","","","","","","","","","","","","","","","","","","","","","","","","","","","","","","","","","","","","","","","","","","","","","","",""
"A4V3ADBU","webpage","","","Norman Studios | Preserving Jacksonville's Silent Film Legacy","","","","","http://www.normanstudios.org/","","","2016-04-14 21:55:22","2016-04-14 21:55:22","2016-04-14 21:55:22","","","","","","","","","","","","","","","","","","","","","","","/Users/karlacontreras/Library/Application Support/Zotero/Profiles/v1v2wix2.default/zotero/storage/9U7E6T5R/www.normanstudios.org.html","","","","","","","","","","","","","","","","","","","","","","","","","","","","","","","","","","","","","","","","","","","","","","","","",""
"ASTTHFDW","webpage","","","Boys Boyz Bois (eBook, 2012) [UCLA Library]","","","","","http://ucla.worldcat.org/title/boys-boyz-bois/oclc/823389526&referer=brief_results","","","2016-05-12 20:55:07","2016-05-12 20:55:07","2016-05-12 20:55:07","","","","","","","","","","","","","","","","","","","","","","","/Users/karlacontreras/Library/Application Support/Zotero/Profiles/v1v2wix2.default/zotero/storage/3MWW5J92/823389526&referer=brief_results.html","","","","","","","","","","","","","","","","","","","","","","","","","","","","","","","","","","","","","","","","","","","","","","","","",""
"AVPHBGBX","bookSection","2001","Taylor, Clyde R.","Black Silence and the Politics of Representation","Oscar Micheaux and His Circle: African-American Filmmaking and Race Cinema of the Silent Era","978-0-253-33994-2","","","","","2001","2016-06-03 21:47:27","2016-06-03 21:48:31","","","","","","","","","","","","","Indiana University Press","Bloomington","","","","","","","","","","","","","","Bowser, Pearl","","","","","","","","","","","","","","","","","","","","","","","","","","","","","","","","","","","","","","","","","","","","",""
"B82X3T6N","book","1977","Cripps, Thomas","Slow Fade to Black Negro in American Film, 1900-42.","","978-0-19-972787-2","","","http://public.eblib.com/choice/PublicFullRecord.aspx?p=253377","Set against the backdrop of the black struggle in society, Slow Fade to Black is the definitive history of African-American accomplishment in film--both before and behind the camera--from the earliest movies through World War II. As he records the changing attitudes toward African-Americans both in Hollywood and the nation at large, Cripps explores the growth of discrimination as filmmakers became more and more intrigued with myths of the Old South: the """"lost cause"""" aspect of the Civil War, the stately mansions and gracious ladies of the antebellum South, the """"happy"""" slaves singing in the.","1977","2016-04-19 22:08:29","2016-04-19 22:08:29","2016-04-19 22:08:29","","","","","","","","","","","","Oxford University Press","Cary","English","","","","","Open WorldCat","","","","","","added","","","","","","","","","","","","","","","","","","","","","","","","","","","","","","","","","","","","","","","","","","","","","","",""
"BDNKJAHT","book","1990","Null, Gary","Black Hollywood : the black performer in motion pictures","","978-0-8065-0908-2","","","","","1990","2016-04-15 03:48:39","2016-04-15 03:48:39","","","","","","","","Black Hollywood","","","","","Carol Pub. Group","New York","","","","","","","","","","/Users/karlacontreras/Library/Application Support/Zotero/Profiles/v1v2wix2.default/zotero/storage/QNSXFR6M/21545833&referer=brief_results.html","","","","","","","","","","","","","","","","","","","","","","","1st Carol Pub. Group ed.","","","","","","","","","","","","","","","","","","","","","","","","","",""
"BDX5SMQW","webpage","","","Black Film Resarch Online","","","","","http://blackfilm.uchicago.edu/research_projects/spencer_williams.shtml","","","2016-04-21 19:41:43","2016-04-21 19:41:43","2016-04-21 19:41:43","","","","","","","","","","","","","","","","","","","","","","","/Users/karlacontreras/Library/Application Support/Zotero/Profiles/v1v2wix2.default/zotero/storage/IUEM7Z9W/spencer_williams.html","","","","","","","","","","","","","","","","","","","","","","","","","","","","","","","","","","","","","","","","","","","","","","","","",""
"BR3F2BX6","webpage","","","African-American Writers and Pre-1950 Cinema - ProQuest","","","","","http://search.proquest.com/docview/2037662/99B7A71090194D05PQ/20?accountid=14512","","","2016-04-14 21:29:47","2016-04-14 21:29:47","2016-04-14 21:28:29","","","","","","","","","","","","","","","","","","","","","","","/Users/karlacontreras/Library/Application Support/Zotero/Profiles/v1v2wix2.default/zotero/storage/8GIAARU6/African-American Writers and Pre-1950 Cinema - Pro.html","","","","","","","","","","","","","","","","","","","","","","","","","","","","","","","","","","","","","","","","","","","","","","","","",""
"BT3BZI4Z","bookSection","2016","Field, Allyson Nadia","The Ambitions of William Foster: Entrepreneurial Filmmaking at the Limits of Uplift Cinema","Early Race Filmmaking in America","","","","","","2016","2016-06-06 20:35:48","2016-06-06 20:38:18","","53-71","","","","","","","Routledge Advances in Film Studies","","","","Routledge","New York","","","","","","","","","","","","","","","","","","","Lupack, Barbara","","","","","","","","","","","","","","","","","","","","","","","","","","","","","","","","","","","","","","","",""
"BTATCUIH","book","1993","Diawara, Manthia","Black American cinema","","978-0-415-90396-7","","","","","1993","2016-04-14 21:15:04","2016-04-14 21:15:04","","","","","","","","","","","","","Routledge","New York","","","","","","","","","","/Users/karlacontreras/Library/Application Support/Zotero/Profiles/v1v2wix2.default/zotero/storage/WGDGPX3R/26633666&referer=brief_results.html","","","","","","","","","","","","","","","","","","","","","","","","","","","","","","","","","","","","","","","","","","","","","","","","",""
"CI5IK5R8","book","2001","Gaines, Jane","Fire and desire: mixed-race movies in the silent era","","978-0-226-27874-2 978-0-226-27875-9","","","","","2001","2016-04-19 22:05:57","2016-04-19 22:05:57","","","","","","","","Fire and desire","","","","","University of Chicago Press","Chicago","English","","","","","Open WorldCat","","","","","","","","","","","","","","","","","","","","","","","","","","","","","","","","","","","","","","","","","","","","","","","","","","","","",""
"CUKW6B9W","book","1998","Carby, Hazel","Race men","","978-0-674-02919-4","","","","","1998","2016-05-16 17:52:26","2016-05-16 17:52:26","","","","","","","","","","","","","Harvard University Press,","Cambridge, Mass. :","","","","","","","","","","/Users/karlacontreras/Library/Application Support/Zotero/Profiles/v1v2wix2.default/zotero/storage/KVC4XRV4/607865202&referer=brief_results.html","","","","","","","","","","","","","","","","","","","","","","","","","","","","","","","","","","","","","","","","","","","","","","","","",""
"DD5Q4A6J","book","2002","Regester, Charlene","Black entertainers in African American newspaper articles","","978-0-7864-1053-8","","","","","2002","2016-04-19 20:36:19","2016-04-19 20:36:19","","","","","","","","","","","","","McFarland","Jefferson  N.C.","","","","","","","","","","/Users/karlacontreras/Library/Application Support/Zotero/Profiles/v1v2wix2.default/zotero/storage/A6VGSH4D/47831202&referer=brief_results.html","","","","","","","","","","","","","","","","","","","","","","","","","","","","","","","","","","","","","","","","","","","","","","","","",""
"DDVDBX4S","book","2012","Guerrero, Ed.","Framing blackness: The African American image in film. Temple University Press, 2012.","","","","","","","2012","2016-04-14 21:27:07","2016-04-14 21:27:31","","","","","","","","","","","","","Temple University Press","","","","","","","","","","","","","","","","","","","","","","","","","","","","","","","","","","","","","","","","","","","","","","","","","","","","","","","","","","","",""
"DQS8A742","webpage","","","BLACK CAMERA | The Black Film Center/Archive | Indiana University Bloomington","","","","","http://www.indiana.edu/~blackcam/resources/","","","2016-04-14 20:58:15","2016-04-14 20:58:15","2016-04-14 20:58:15","","","","","","","","","","","","","","","","","","","","","","","/Users/karlacontreras/Library/Application Support/Zotero/Profiles/v1v2wix2.default/zotero/storage/XECVPPZ9/resources.html","","","","","","","","","","","","","","","","","","","","","","","","","","","","","","","","","","","","","","","","","","","","","","","","",""
"EDX3C95A","journalArticle","1993","Gaines, jane","Gaines, Jane. ""Fire and Desire: Race, Melodrama, and Oscar Micheaux."" Black American Cinema (1993): 49-70.","Black American Cinema","","","","","","1993","2016-04-14 21:33:42","2016-04-14 21:34:23","","49-70","","","","","","","","","","","","","","","","","","","","","","","","","","","","","","","","","","","","","","","","","","","","","","","","","","","","","","","","","","","","","","","","","","","","","","",""
"F532N2ND","webpage","","","UCLA Library Catalog Holdings Information","","","","","http://catalog.library.ucla.edu/vwebv/holdingsInfo?searchId=1585&recCount=50&recPointer=1&bibId=4627798","","","2016-05-16 18:02:03","2016-05-16 18:02:03","2016-05-16 18:02:03","","","","","","","","","","","","","","","","","","","","","","","/Users/karlacontreras/Library/Application Support/Zotero/Profiles/v1v2wix2.default/zotero/storage/SZ6ABMB2/holdingsInfo.html","","","","","","","","","","","","","","","","","","","","","","","","","","","","","","","","","","","","","","","","","","","","","","","","",""
"FNUJHJH9","journalArticle","2008","Petersen, Christina","The 'Reol' Story: Race Authorship and Consciousness in Robert Levy's Reol Productions, 1921–1926","Film History: An International Journal","","1553-3905","","https://muse.jhu.edu/article/254498","","2008","2016-04-20 03:49:53","2016-04-20 03:49:53","2016-04-20 03:49:53","308-324","","3","20","","","The 'Reol' Story","","","","","","","","","","","","muse.jhu.edu","","","","/Users/karlacontreras/Library/Application Support/Zotero/Profiles/v1v2wix2.default/zotero/storage/CRCVK9XE/254498.html","","added","","","","","","","","","","","","","","","","","","","","","","","","","","","","","","","","","","","","","","","","","","","","","","",""
"FQA92TNQ","webpage","","","Separate Cinema","","","","","http://www.separatecinema.com/","","","2016-04-14 21:15:46","2016-04-14 21:15:46","2016-04-14 21:15:46","","","","","","","","","","","","","","","","","","","","","","","/Users/karlacontreras/Library/Application Support/Zotero/Profiles/v1v2wix2.default/zotero/storage/QMFNTS54/www.separatecinema.com.html","","","","","","","","","","","","","","","","","","","","","","","","","","","","","","","","","","","","","","","","","","","","","","","","",""
"GHEQWNUV","book","2007","Berry, Torriano","Historical dictionary of African American cinema","","978-0-8108-5930-2","","","","","2007","2016-04-15 03:46:26","2016-04-15 03:46:26","","","","","","","","","","","","","Scarecrow Press,","Lanham, Md. :","","","","","","","","","","/Users/karlacontreras/Library/Application Support/Zotero/Profiles/v1v2wix2.default/zotero/storage/35JDDUF6/643556996&referer=brief_results.html","","","","","","","","","","","","","","","","","","","","","","","","","","","","","","","","","","","","","","","","","","","","","","","","",""
"GQ4CH4AV","webpage","","","Screening a lynching : the Leo Frank case on film and television (Book, 2009) [UCLA Library]","","","","","http://ucla.worldcat.org/title/screening-a-lynching-the-leo-frank-case-on-film-and-television/oclc/225874021&referer=brief_results","","","2016-04-14 21:34:23","2016-04-14 21:34:23","2016-04-14 21:34:23","","","","","","","","","","","","","","","","","","","","","","","/Users/karlacontreras/Library/Application Support/Zotero/Profiles/v1v2wix2.default/zotero/storage/8HWUNSPA/225874021&referer=brief_results.html","","Lynching","","","","","","","","","","","","","","","","","","","","","","","","","","","","","","","","","","","","","","","","","","","","","","",""
